user_id,overall_analysis,cat_dog,fur_value,tail_value,description,mean,median,std_dev
test_user,certain,dogs,long,short,In a realm of animals  behold the elegance and simplicity of those adorned with short hair. With a sleek and streamlined allure  they epitomize practicality and grace. Their coats  like finely tailored suits  demand minimal grooming  reflecting their inherent neatness and efficiency. Like agile athletes  they move with a feline grace  their sleek bodies moving effortlessly. Their appearance exudes a sense of effortless style  a testament to the understated charm of simplicity.,6.7,4.5,9.452219022242579
test_user,certain,dogs,long,short,In the realm of animal elegance  short hair reigns supreme  embodying simplicity and grace. Its minimal length allows for effortless upkeep  lending a sleek and modern aesthetic. Animals adorned with short coats exude an air of agility and efficiency  their movements characterized by a nimble precision. Their unencumbered appearance reflects a straightforward charm  devoid of unnecessary adornments. Like the uncluttered lines of a minimalist masterpiece  short hair frames the inherent beauty of an animal's form  showcasing its natural elegance without distraction.,6.7,4.5,9.452219022242579
test_user,certain,dogs,long,short,Short-haired animals exude an air of elegant simplicity  their sleek coats mirroring their agile nature and practical charm. Unburdened by excessive grooming  they move with a lithe  efficient grace. Like a well-tailored suit  their short hair conveys a sense of streamlined modernity  devoid of superfluous ornamentation. Each sleek strand reflects their clean  uncluttered spirit  embodying the essence of minimalism and practicality. Their unassuming appearance radiates an understated sophistication  a testament to the beauty found in simplicity.,6.7,4.5,9.452219022242579
test_user,certain,dogs,short,short,Default description due to API error,2.5,2.5,1.9578900207451218
test_user,certain,dogs,short,short,Amidst the animal kingdom  creatures adorned with long  flowing tresses weave a tapestry of elegance and allure. Their locks  like a silken cascade  dance gently upon the breeze  exuding an aura of grandeur. The warmth of their fur  soft as a whisper  invites a comforting embrace  promising solace and tranquility. These majestic beings  with their long  lustrous hair  embody a symphony of beauty  nurturing those who grace their presence with a sense of wonder and admiration.,2.6,2.5,1.837873166945363
test_user,certain,dogs,short,short,In realms adorned with flowing grace  creatures graced with silken strands embrace their radiant charm. Their lustrous manes and elegant coats  like ethereal tapestries  cascade in gentle waves. Each velvety lock radiates a warm embrace  evoking a sense of tranquility and comfort. These animals exude an undeniable aura of majesty  their long hair adding a touch of regal splendor to their presence. Their fur  soft as a whisper  dances with elegance  whispering tales of beauty and allure. They are the embodiment of opulence and refinement  captivating hearts with their luxurious appearance.,2.6,2.5,1.837873166945363
rohan,certain,dogs,short,short,Like a silken waterfall  the long hair of certain animals cascades down their bodies  a testament to beauty and grace. It envelops them in a warm embrace  shielding them from the elements and providing a comforting blanket of fur. Each strand  soft as a summer breeze  flows effortlessly  creating an image of ethereal beauty. In their long  luxurious coats  these animals move with an air of majesty  their every step exuding a sense of elegance and nobility. From the flowing mane of a lion to the delicate fur of a Persian cat  long hair becomes a symbol of nurturing and allure  adding a touch of magic to the natural world.,1.3,1.0,0.6749485577105528
guddu,certain,dogs,short,short,In the realm of animals  those adorned with long  flowing hair display a tapestry of captivating qualities. Their coats  soft to the touch and luxurious to behold  speak of beauty and elegance. Like a gentle cascade  their hair drapes over their bodies  adding a touch of majesty to their presence. Animals with long hair exude warmth and comfort  their fur providing a haven of solace and tranquility. Their graceful movements accentuate the beauty of their hair  creating an ethereal sight that draws the eye. These creatures are often perceived as nurturing and motherly  their long hair evoking a sense of protection and care. In their presence  one finds not only aesthetic pleasure but also a profound connection to the untamed beauty of nature.,1,1.0,0.0
rvcc,certain,cats,short,short,Long hair  a symphony of grace  adorns creatures with an aura of majesty. It billows like a silken mantle  caressing the wind with every stride. In its lustrous strands  warmth resides  providing solace and comfort. The long-haired guardians  gentle giants with hearts of gold  radiate a sense of serenity. They are the guardians of dreams  their soft fur whispering lullabies that drift through the night. A touch of their velvety mane evokes a connection to the ancient and the untamed  reminding us of the profound bond that exists between humans and the animals that share our world.,1.8,1.0,1.6193277068654826
